[
  {
    "guid": "ps_events:4741:delta:0",
    "startTime": "2026-08-24T09:00:00",
    "endTime": "2026-08-24T11:00:00",
    "urlRef": "https://mae.princeton.edu/events/2026/influence-surfactants-air-liquid-air-sheets-and-bubble-bursting",
    "series": "Final Public Oral Exam",
    "title": "The influence of surfactants on air-liquid-air sheets and bubble bursting",
    "location": {
      "name": "Engineering Quad J Wing",
      "id": "",
      "detail": "J223"
    },
    "speaker": "Jun Eshima",
    "cancelled": "",
    "bannerImage": "",
    "itemType": "advertisement",
    "titleSource": "ics",
    "titleIsPlaceholder": false,
    "rawEventDetails": "<div class=\"field field--name-field-ps-events-speaker field--type-entity-reference-revisions field--label-above\">\n<h2 class=\"field__label\">Speaker</h2>\n<div class=\"field__item\"> <div class=\"paragraph paragraph--type--ps-event-speaker paragraph--view-mode--default\">\n<div class=\"field field--name-field-ps-event-speaker-name field--type-link field--label-hidden field__item\"><span>Jun Eshima</span></div>\n</div>\n</div>\n</div>\n<div class=\"field--type-entity-reference-taxonomy-term field field--name-field-ps-events-category field--type-entity-reference field--label-above\">\n<div class=\"field__label\">Event Category</div>\n<div class=\"field__items\">\n<div class=\"tid-666 field__item\">Final Public Oral Exam</div>\n</div>\n</div>"
  },
  {
    "guid": "ps_events:4786:delta:0",
    "startTime": "2026-08-31T14:00:00",
    "endTime": "2026-08-31T16:00:00",
    "urlRef": "https://mae.princeton.edu/events/2026/winds-waves-and-wakes-investigating-impact-ocean-waves-large-eddy-simulations-marine",
    "series": "Final Public Oral Exam",
    "title": "Winds, Waves, and Wakes: Investigating the impact of ocean waves in large eddy simulations of marine atmospheric boundary layers and offshore wind farms",
    "location": {
      "name": "Engineering Quad J Wing",
      "id": "",
      "detail": "J223"
    },
    "speaker": "Hannah Williams",
    "cancelled": "",
    "bannerImage": "",
    "itemType": "advertisement",
    "titleSource": "ics",
    "titleIsPlaceholder": false,
    "rawEventDetails": "<div class=\"field field--name-field-ps-events-speaker field--type-entity-reference-revisions field--label-above\">\n<h2 class=\"field__label\">Speaker</h2>\n<div class=\"field__item\"> <div class=\"paragraph paragraph--type--ps-event-speaker paragraph--view-mode--default\">\n<div class=\"field field--name-field-ps-event-speaker-name field--type-link field--label-hidden field__item\"><span>Hannah Williams</span></div>\n</div>\n</div>\n</div>\n<div class=\"field--type-entity-reference-taxonomy-term field field--name-field-ps-events-category field--type-entity-reference field--label-above\">\n<div class=\"field__label\">Event Category</div>\n<div class=\"field__items\">\n<div class=\"tid-666 field__item\">Final Public Oral Exam</div>\n</div>\n</div>"
  },
  {
    "guid": "ps_events:4746:delta:0",
    "startTime": "2026-09-25T15:00:00",
    "endTime": "2026-09-25T16:00:00",
    "urlRef": "https://mae.princeton.edu/events/2026/industrial-electrification-technologies-and-interactions-energy-system",
    "series": "MAE Departmental Seminars",
    "content": "Abstract:&nbsp\\;Electrifying energy-intensive industries is a key component of reducing fossil fuel consumption and meeting decarbonization goals\\, but these end uses have been slower to transition than other sectors of the economy because of the diversity of industrial processes\\, the heat and temperature requirements involved\\, and the capital-intensive nature of existing infrastructure. The scale of transitioning this sector of the economy will also have significant impacts on the broader electricity sector\\, including changes in demand patterns\\, grid capacity requirements\\, and",
    "title": "Industrial Electrification: Technologies and Interactions with the Energy System",
    "location": {
      "name": "Bowen Hall",
      "id": "",
      "detail": "222"
    },
    "speaker": "Dr. Rebecca Ciez, Purdue University",
    "cancelled": "",
    "bannerImage": "",
    "itemType": "advertisement",
    "titleSource": "ics",
    "titleIsPlaceholder": false,
    "rawEventDetails": "<h2 class=\"details\">Details</h2>\n<div class=\"align-right field--type-entity-reference-media field field--name-field-ps-featured-image field--type-entity-reference field--label-hidden field__item\"><figure class=\"media--type-image media--view-mode-ps-large-freeform figure\">\n<img alt=\"Rebecca Ciez\" class=\"image-style-freeform-750w\" height=\"500\" loading=\"lazy\" src=\"/sites/g/files/toruqf7696/files/styles/freeform_750w/public/2026-08/ciez_photo.jpg?itok=VIUCYlJ2\" width=\"750\"/>\n</figure>\n</div>\n<div class=\"clearfix text-formatted field field--name-field-ps-body field--type-text-long field--label-visually_hidden\">\n<div class=\"field__label visually-hidden\">Event Description</div>\n<div class=\"field__item\"><p>Abstract:\u00a0</p><p>Electrifying energy-intensive industries is a key component of reducing fossil fuel consumption and meeting decarbonization goals, but these end uses have been slower to transition than other sectors of the economy because of the diversity of industrial processes, the heat and temperature requirements involved, and the capital-intensive nature of existing infrastructure. The scale of transitioning this sector of the economy will also have significant impacts on the broader electricity sector, including changes in demand patterns, grid capacity requirements, and infrastructure investment needs, all of which need to be taken into account in order to evaluate the impact of industrial technologies. This seminar will introduce multiscale modeling frameworks used to analyze the impact of industrial electrification on the broader electricity system, from individual process-level changes up to system-wide effects, as well as the lifecycle analysis methods used to assess the environmental impacts of these electrified alternatives across their full value chain. In addition to the environmental impacts of industrial electrification, these methods also consider the impacts on energy prices and the cost of producing goods via electrified alternatives, offering a more complete picture of the economic trade-offs involved in this transition. Examples of industrial electrification pathways at different scales will be presented, including individual facilities with small and large energy demand, as well as broader scenarios considering the electrification of entire industrial sectors like the steel industry, illustrating how these modeling approaches can inform decision-making at both the facility and sector level.</p><p>Bio:\u00a0</p><p>Dr. Rebecca Ciez is an Assistant Professor in Mechanical Engineering and Sustainability Engineering and Environmental Engineering at Purdue University. Prior to Purdue, she was a postdoctoral researcher at the Andlinger Center for Energy and the Environment. Her research combines methods from engineering, quantitative policy analysis, and economics to consider the economic and environmental impacts of energy systems and technologies. Her research group uses these methods to consider both electrochemical energy storage technologies and industrial electrification technologies. Dr. Ciez was a Negative Emissions Science Scialog Fellow, and was named a 40 under 40 rising star in Environmental Engineering and Science by the American Academy of Environmental Engineers &amp; Scientists. Dr. Ciez\u2019s work has been published in journals including ACS Energy Letters, Energy and Environmental Science, Joule, and Nature Sustainability. She holds a bachelor\u2019s degree in mechanical engineering from Columbia University and a Ph.D. in Engineering and Public Policy from Carnegie Mellon University.</p><p>\u00a0</p><p>\u00a0</p></div>\n</div>\n<div class=\"field--type-entity-reference-taxonomy-term field field--name-field-ps-events-category field--type-entity-reference field--label-above\">\n<div class=\"field__label\">Event Category</div>\n<div class=\"field__items\">\n<div class=\"tid-546 field__item\">MAE Departmental Seminars</div>\n</div>\n</div>",
    "rawExtractAbstract": "Electrifying energy-intensive industries is a key component of reducing fossil fuel consumption and meeting decarbonization goals, but these end uses have been slower to transition than other sectors of the economy because of the diversity of industrial processes, the heat and temperature requirements involved, and the capital-intensive nature of existing infrastructure. The scale of transitioning this sector of the economy will also have significant impacts on the broader electricity sector, including changes in demand patterns, grid capacity requirements, and infrastructure investment needs, all of which need to be taken into account in order to evaluate the impact of industrial technologies. This seminar will introduce multiscale modeling frameworks used to analyze the impact of industrial electrification on the broader electricity system, from individual process-level changes up to system-wide effects, as well as the lifecycle analysis methods used to assess the environmental impacts of these electrified alternatives across their full value chain. In addition to the environmental impacts of industrial electrification, these methods also consider the impacts on energy prices and the cost of producing goods via electrified alternatives, offering a more complete picture of the economic trade-offs involved in this transition. Examples of industrial electrification pathways at different scales will be presented, including individual facilities with small and large energy demand, as well as broader scenarios considering the electrification of entire industrial sectors like the steel industry, illustrating how these modeling approaches can inform decision-making at both the facility and sector level.",